{"action_coverage_status":"COMPLETE","action_results":[{"action_id":"create_pin","assertions":[{"expected":true,"observed":"ACTOR_NOT_ALLOWED","passed":true,"pointer":"/result/error/code","type":"path_present"}],"components":{"authoritative_state":{"changed":false,"expectation":"UNCHANGED","passed":true},"business_side_effects":{"changed":false,"expectation":"UNCHANGED","passed":true},"delivery_effects":{"changed":false,"expectation":"UNCHANGED","passed":true},"history":{"changed":false,"expectation":"UNCHANGED","passed":true},"revision":{"changed":false,"expectation":"UNCHANGED","passed":true}},"conformant":true,"evidence_sha256":"60d4c5dfcd33d2d18be23d23d0b6bbb95d334562d0b9c66cf232bb335e8cade9","expected_result":"REJECTED","failures":[],"input_invariant_failures":[],"observed_result":"REJECTED","result_matches":true,"runtime_evidence":{"adapter":{"name":"m6-dogfood-local-fixture","version":"1.0.0"},"after":{"authoritative_state":{"active_review_link_id":null,"pins":[],"project_id":"project-fixture-001","review_link_revision":0,"review_links":[],"threads":[],"version":{"revision":1,"status":"DRAFT","version_id":"version-fixture-001"}},"business_side_effects":[],"delivery_effects":[],"history":[],"revision":1},"authority":{"approved_digest":"e33deda04bae78eab0da60ba432c47a0779bce17c4bee7d1c5695455d9d9f68c","approved_revision":1},"before":{"authoritative_state":{"active_review_link_id":null,"pins":[],"project_id":"project-fixture-001","review_link_revision":0,"review_links":[],"threads":[],"version":{"revision":1,"status":"DRAFT","version_id":"version-fixture-001"}},"business_side_effects":[],"delivery_effects":[],"history":[],"revision":1},"command":{"action_id":"create_pin","actor":"UNAUTHORIZED_FIXTURE_ACTOR","comment":"Fixture root comment.","media_type":"IMAGE","message_attempt_id":"target-create_pin","project_id":"project-fixture-001","version_id":"version-fixture-001","x":0.25,"y":0.75},"contract_hash":"b00b45e8ca4804289f5d8af3bb55fc6569ee65771838459b8ba49583df349b57","deltas":{"authoritative_state":{},"business_side_effects":[],"delivery_effects":[],"history":[],"revision":0},"frozen_source":{"commit":"bbbbbbbbbbbbbbbbbbbbbbbbbbbbbbbbbbbbbbbb","tree":"cccccccccccccccccccccccccccccccccccccccc"},"product_slug":"client-feedback-portal-dogfood-v2","protocol_version":"joewrks.downstream.execution/1.0","record_kind":"execution_evidence","result":{"error":{"code":"ACTOR_NOT_ALLOWED"},"result_class":"REJECTED"},"sequence_id":"M6-TEST-20bef088ebc99c0feea3f468","test_id":"TEST-20bef088ebc99c0feea3f468"},"source_contract":{"approved_definition_digest":"e33deda04bae78eab0da60ba432c47a0779bce17c4bee7d1c5695455d9d9f68c","approved_revision":1,"contract_schema_version":"joewrks.action-conformance/2.1","product_slug":"client-feedback-portal-dogfood-v2","semantic_contract_hash":"b00b45e8ca4804289f5d8af3bb55fc6569ee65771838459b8ba49583df349b57"},"test_id":"TEST-20bef088ebc99c0feea3f468"},{"action_id":"create_pin","assertions":[{"expected":true,"observed":{"pin_id":"pin-001","result_class":"SUCCESS","thread_id":"thread-001","version_id":"version-fixture-001"},"passed":true,"pointer":"/result/committed_result","type":"path_present"}],"components":{"authoritative_state":{"changed":false,"expectation":"UNCHANGED","passed":true},"business_side_effects":{"changed":false,"expectation":"UNCHANGED","passed":true},"delivery_effects":{"changed":false,"expectation":"UNCHANGED","passed":true},"history":{"changed":false,"expectation":"UNCHANGED","passed":true},"revision":{"changed":false,"expectation":"UNCHANGED","passed":true}},"conformant":true,"evidence_sha256":"a2e345b97199eeb6ccdbb012b7a7c05c98e23681deed6b5bb3b774f40fc5b362","expected_result":"IDEMPOTENT_REPLAY","failures":[],"input_invariant_failures":[],"observed_result":"IDEMPOTENT_REPLAY","result_matches":true,"runtime_evidence":{"adapter":{"name":"m6-dogfood-local-fixture","version":"1.0.0"},"after":{"authoritative_state":{"active_review_link_id":null,"pins":[{"media_type":"IMAGE","pin_id":"pin-001","root_comment":"Fixture root comment.","thread_id":"thread-001","version_id":"version-fixture-001","x":0.25,"y":0.75}],"project_id":"project-fixture-001","review_link_revision":0,"review_links":[],"threads":[{"pin_id":"pin-001","replies":[],"root_comment":"Fixture root comment.","status":"OPEN","thread_id":"thread-001"}],"version":{"revision":2,"status":"DRAFT","version_id":"version-fixture-001"}},"business_side_effects":[{"action_id":"create_pin","effect":"PIN_CREATED","pin_id":"pin-001","sequence":1,"thread_id":"thread-001"}],"delivery_effects":[],"history":[{"action_id":"create_pin","actor":"Client Reviewer","event":"PIN_CREATED","pin_id":"pin-001","sequence":1,"thread_id":"thread-001"}],"revision":2},"authority":{"approved_digest":"e33deda04bae78eab0da60ba432c47a0779bce17c4bee7d1c5695455d9d9f68c","approved_revision":1},"before":{"authoritative_state":{"active_review_link_id":null,"pins":[{"media_type":"IMAGE","pin_id":"pin-001","root_comment":"Fixture root comment.","thread_id":"thread-001","version_id":"version-fixture-001","x":0.25,"y":0.75}],"project_id":"project-fixture-001","review_link_revision":0,"review_links":[],"threads":[{"pin_id":"pin-001","replies":[],"root_comment":"Fixture root comment.","status":"OPEN","thread_id":"thread-001"}],"version":{"revision":2,"status":"DRAFT","version_id":"version-fixture-001"}},"business_side_effects":[{"action_id":"create_pin","effect":"PIN_CREATED","pin_id":"pin-001","sequence":1,"thread_id":"thread-001"}],"delivery_effects":[],"history":[{"action_id":"create_pin","actor":"Client Reviewer","event":"PIN_CREATED","pin_id":"pin-001","sequence":1,"thread_id":"thread-001"}],"revision":2},"command":{"action_id":"create_pin","actor":"Client Reviewer","comment":"Fixture root comment.","media_type":"IMAGE","message_attempt_id":"target-create_pin","project_id":"project-fixture-001","version_id":"version-fixture-001","x":0.25,"y":0.75},"contract_hash":"b00b45e8ca4804289f5d8af3bb55fc6569ee65771838459b8ba49583df349b57","deltas":{"authoritative_state":{},"business_side_effects":[],"delivery_effects":[],"history":[],"revision":0},"frozen_source":{"commit":"bbbbbbbbbbbbbbbbbbbbbbbbbbbbbbbbbbbbbbbb","tree":"cccccccccccccccccccccccccccccccccccccccc"},"product_slug":"client-feedback-portal-dogfood-v2","protocol_version":"joewrks.downstream.execution/1.0","record_kind":"execution_evidence","result":{"committed_result":{"pin_id":"pin-001","result_class":"SUCCESS","thread_id":"thread-001","version_id":"version-fixture-001"},"result_class":"IDEMPOTENT_REPLAY"},"sequence_id":"M6-TEST-81987fbd406c633781630ed7","test_id":"TEST-81987fbd406c633781630ed7"},"source_contract":{"approved_definition_digest":"e33deda04bae78eab0da60ba432c47a0779bce17c4bee7d1c5695455d9d9f68c","approved_revision":1,"contract_schema_version":"joewrks.action-conformance/2.1","product_slug":"client-feedback-portal-dogfood-v2","semantic_contract_hash":"b00b45e8ca4804289f5d8af3bb55fc6569ee65771838459b8ba49583df349b57"},"test_id":"TEST-81987fbd406c633781630ed7"},{"action_id":"create_pin","assertions":[{"expected":"Client Reviewer","observed":"Client Reviewer","passed":true,"pointer":"/command/actor","type":"path_equals"},{"expected":true,"observed":"create_pin","passed":true,"pointer":"/command/action_id","type":"path_present"}],"components":{"authoritative_state":{"changed":true,"expectation":"CHANGED","passed":true},"business_side_effects":{"changed":true,"expectation":"CHANGED","passed":true},"delivery_effects":{"changed":false,"expectation":"UNCHANGED","passed":true},"history":{"changed":true,"expectation":"CHANGED","passed":true},"revision":{"changed":true,"expectation":"CHANGED","passed":true}},"conformant":true,"evidence_sha256":"1cb5cc2c904274654a62b6867ce2ad80f6b097767a2f7c0212a376f48abbb6d3","expected_result":"SUCCESS","failures":[],"input_invariant_failures":[],"observed_result":"SUCCESS","result_matches":true,"runtime_evidence":{"adapter":{"name":"m6-dogfood-local-fixture","version":"1.0.0"},"after":{"authoritative_state":{"active_review_link_id":null,"pins":[{"media_type":"IMAGE","pin_id":"pin-001","root_comment":"Fixture root comment.","thread_id":"thread-001","version_id":"version-fixture-001","x":0.25,"y":0.75}],"project_id":"project-fixture-001","review_link_revision":0,"review_links":[],"threads":[{"pin_id":"pin-001","replies":[],"root_comment":"Fixture root comment.","status":"OPEN","thread_id":"thread-001"}],"version":{"revision":2,"status":"DRAFT","version_id":"version-fixture-001"}},"business_side_effects":[{"action_id":"create_pin","effect":"PIN_CREATED","pin_id":"pin-001","sequence":1,"thread_id":"thread-001"}],"delivery_effects":[],"history":[{"action_id":"create_pin","actor":"Client Reviewer","event":"PIN_CREATED","pin_id":"pin-001","sequence":1,"thread_id":"thread-001"}],"revision":2},"authority":{"approved_digest":"e33deda04bae78eab0da60ba432c47a0779bce17c4bee7d1c5695455d9d9f68c","approved_revision":1},"before":{"authoritative_state":{"active_review_link_id":null,"pins":[],"project_id":"project-fixture-001","review_link_revision":0,"review_links":[],"threads":[],"version":{"revision":1,"status":"DRAFT","version_id":"version-fixture-001"}},"business_side_effects":[],"delivery_effects":[],"history":[],"revision":1},"command":{"action_id":"create_pin","actor":"Client Reviewer","comment":"Fixture root comment.","media_type":"IMAGE","message_attempt_id":"target-create_pin","project_id":"project-fixture-001","version_id":"version-fixture-001","x":0.25,"y":0.75},"contract_hash":"b00b45e8ca4804289f5d8af3bb55fc6569ee65771838459b8ba49583df349b57","deltas":{"authoritative_state":{"pins":[{"media_type":"IMAGE","pin_id":"pin-001","root_comment":"Fixture root comment.","thread_id":"thread-001","version_id":"version-fixture-001","x":0.25,"y":0.75}],"threads":[{"pin_id":"pin-001","replies":[],"root_comment":"Fixture root comment.","status":"OPEN","thread_id":"thread-001"}],"version":{"revision":2,"status":"DRAFT","version_id":"version-fixture-001"}},"business_side_effects":[{"a